{
  "meta": {
    "schema_version": "1.0",
    "title": "示例化工品供应商近期风险雷达",
    "subtitle": "演示数据 · 用于跑通 data.json → Excel + HTML 流程",
    "product": "示例化工品",
    "product_en": "DEMO CHEM",
    "product_full": "示例化工品（演示用，非真实产品）",
    "query_date": "2026-10-19",
    "query_time": "2026-10-19 13:20",
    "window_default": "6m",
    "windows": {
      "3m": {"label": "近3个月", "start": "2026-07-19", "end": "2026-10-19"},
      "6m": {"label": "近6个月", "start": "2026-04-19", "end": "2026-10-19"},
      "12m": {"label": "近1年", "start": "2025-10-19", "end": "2026-10-19"}
    },
    "scope_note": "演示文件：用于验证字段、生成器与版式，不构成任何真实供应商判断。",
    "scope_summary": "演示数据：默认近 6 个月（2026-04-19 至 2026-10-19），覆盖 4 家示例供应商。所有企业、事件、数字均为占位，不可用于真实决策。",
    "financial_period": "2026H1",
    "period_tag": "2026-10",
    "channels": "示例公告 / 示例监管公示 / 示例行业资讯",
    "nature": "演示用占位数据，不可用于任何真实决策",
    "industry_title": "示例行业供需与检修（占位）"
  },
  "suppliers": [
    {
      "id": "D1",
      "name": "示例化工A",
      "full_name": "示例化工A股份有限公司",
      "code": "000001.SZ",
      "market": "深交所主板",
      "region": "示例省A市",
      "process": "氨碱法",
      "capacity": "120 万吨/年",
      "capacity_short": "120 万吨",
      "revenue": "30.00 亿元",
      "profit": "2.00 亿元",
      "profit_yoy": "+5.00%",
      "risk_level": "低",
      "risk_label": "常规检修 + 产能投放",
      "conclusion": "窗口内以常规检修和新增产能投放为主，未检索到处罚或事故类公开记录；新增产能对供应能力偏正面。",
      "coverage": "公告与行业资讯覆盖充分；地方处罚公示待按注册地复核",
      "tags": ["上市", "氨碱法", "新增产能"]
    },
    {
      "id": "D2",
      "name": "示例化工B",
      "full_name": "示例化工B股份有限公司",
      "code": "000002.SZ",
      "market": "深交所主板",
      "region": "示例省B市",
      "process": "联碱法",
      "capacity": "80 万吨/年",
      "capacity_short": "80 万吨",
      "revenue": "18.00 亿元",
      "profit": "-0.50 亿元",
      "profit_yoy": "-120.00%",
      "risk_level": "中",
      "risk_label": "亏损 + 合同纠纷 + 检修",
      "conclusion": "上半年转亏，叠加合同纠纷与计划检修，需重点确认现金流、履约与排产；公开信息不足以判断是否断供。",
      "coverage": "公告与司法公示覆盖一般；执行与失信信息待复核",
      "tags": ["上市", "联碱法", "亏损", "司法"]
    },
    {
      "id": "D3",
      "name": "示例化工C",
      "full_name": "示例化工C有限公司",
      "code": "非上市",
      "market": "非上市",
      "region": "示例省C市",
      "process": "天然碱法",
      "capacity": "200 万吨/年",
      "capacity_short": "200 万吨",
      "revenue": "未披露",
      "profit": "未披露",
      "profit_yoy": "—",
      "risk_level": "中低",
      "risk_label": "单笔海关罚单",
      "conclusion": "一笔低金额海关罚单，未见停产或事故；对交付的直接影响有限，但需确认整改与报关合规。",
      "coverage": "海关公示可核；非上市财务不公开",
      "tags": ["非上市", "天然碱法", "海关"]
    },
    {
      "id": "D4",
      "name": "示例化工D",
      "full_name": "示例化工D股份有限公司",
      "code": "000004.SZ",
      "market": "上交所主板",
      "region": "示例省D市",
      "process": "氨碱法",
      "capacity": "60 万吨/年",
      "capacity_short": "60 万吨",
      "revenue": "9.00 亿元",
      "profit": "1.00 亿元",
      "profit_yoy": "+20.00%",
      "risk_level": "低",
      "risk_label": "治理层常规调整",
      "conclusion": "仅见董监高常规调整，未检索到经营异常、处罚或事故；维持常规跟踪即可。",
      "coverage": "公告覆盖充分；地方信用公示待复核",
      "tags": ["上市", "氨碱法", "治理"]
    }
  ],
  "events": [
    {
      "id": "D2-E1",
      "date": "2026-09-20",
      "supplier_id": "D2",
      "supplier": "示例化工B",
      "category": "安全环保",
      "severity": "中",
      "direction": "风险",
      "title": "计划性检修 20 天，涉及一条联碱线",
      "fact": "公司公告称，因年度检修安排，B 基地一条联碱生产线自 9 月 20 日起停车检修，预计 20 天，另一条线正常生产。",
      "why": "检修会降低短期可供量；但属于计划内安排，且另一条线仍在生产，不能直接推定为交付中断。",
      "source": "示例化工B 检修公告（占位）",
      "source_type": "公司公告",
      "source_date": "2026-09-18",
      "url": "https://example.com/demo/d2-maintenance",
      "url_label": "示例公告",
      "evidence": "A",
      "questions": [
        "检修线对应的月度排产减少多少吨？",
        "另一条线的负荷能否覆盖既有合同？",
        "复产时间是否有书面确认？"
      ],
      "action": "索取检修期间排产表与复产确认，合同中保留替代货源条款。",
      "tags": ["检修", "排产"]
    },
    {
      "id": "D1-E1",
      "date": "2026-09-05",
      "supplier_id": "D1",
      "supplier": "示例化工A",
      "category": "经营动态",
      "severity": "低",
      "direction": "正向",
      "title": "新增 20 万吨产能进入试生产",
      "fact": "公司公告称，A 基地新增 20 万吨/年装置于 9 月初进入试生产，达产后总产能由 100 万吨提升至 120 万吨。",
      "why": "新增产能对供应能力偏正面，但试生产到达产仍有爬坡期，短期可供量不宜按名义产能计算。",
      "source": "示例化工A 试生产公告（占位）",
      "source_type": "公司公告",
      "source_date": "2026-09-05",
      "url": "https://example.com/demo/d1-capacity",
      "url_label": "示例公告",
      "evidence": "A",
      "questions": [
        "试生产阶段的实际日产量是多少？",
        "预计何时达产、何时可稳定供货？",
        "新增产量的质量指标是否与既有牌号一致？"
      ],
      "action": "把“试生产”与“达产”分开写入供应计划，先小批量验证。",
      "tags": ["新增产能", "试生产"]
    },
    {
      "id": "D3-E1",
      "date": "2026-08-15",
      "supplier_id": "D3",
      "supplier": "示例化工C",
      "category": "处罚",
      "severity": "低",
      "direction": "风险",
      "title": "因报关申报不实被海关罚款 6 万元",
      "fact": "示例海关公示显示，示例化工C 因一票货物申报要素与实际不符，被处以罚款 6 万元，处罚决定日期为 2026 年 8 月 15 日。",
      "why": "金额较小，未见暂停报关或停产；但反映单证与报关管理存在瑕疵，若涉及进口原料或出口交付需确认整改。",
      "source": "示例海关行政处罚公示（占位）",
      "source_type": "海关公示",
      "source_date": "2026-08-15",
      "url": "https://example.com/demo/d3-customs",
      "url_label": "示例公示",
      "evidence": "B",
      "questions": [
        "处罚是否已缴纳并完成整改？",
        "是否影响其进口原料或出口报关资质？",
        "同一年度是否还有其他海关处罚？"
      ],
      "action": "要求提供整改说明与海关信用等级证明。",
      "tags": ["海关", "罚单"]
    },
    {
      "id": "D2-E2",
      "date": "2026-07-01",
      "supplier_id": "D2",
      "supplier": "示例化工B",
      "category": "司法",
      "severity": "中",
      "direction": "风险",
      "title": "一起买卖合同纠纷一审立案，标的 1,200 万元",
      "fact": "示例法院公开信息显示，示例化工B 作为被告的一起买卖合同纠纷于 2026 年 7 月 1 日立案，标的金额 1,200 万元，尚未见判决。",
      "why": "标的金额约占其上半年营收的 0.7%，单案不必然影响交付；但结合亏损，需关注现金流与后续执行风险。",
      "source": "示例法院立案信息（占位）",
      "source_type": "司法公示",
      "source_date": "2026-07-01",
      "url": "https://example.com/demo/d2-lawsuit",
      "url_label": "示例立案信息",
      "evidence": "B",
      "questions": [
        "案件是否已开庭、是否有和解可能？",
        "是否存在其他未披露的诉讼或执行案件？",
        "公司现金流能否覆盖潜在赔付？"
      ],
      "action": "把诉讼与执行信息列入续约前核查清单，要求书面说明。",
      "tags": ["诉讼", "现金流"]
    },
    {
      "id": "D4-E1",
      "date": "2026-05-10",
      "supplier_id": "D4",
      "supplier": "示例化工D",
      "category": "工商",
      "severity": "低",
      "direction": "中性",
      "title": "财务负责人发生常规变更",
      "fact": "公司公告称，财务负责人因个人原因辞任，董事会聘任新任财务负责人，自 2026 年 5 月 10 日起生效。",
      "why": "属于治理层常规变动，未见控制权或经营异常；对交付的直接影响很低，但可关注后续融资与结算安排是否变化。",
      "source": "示例化工D 人事公告（占位）",
      "source_type": "公司公告",
      "source_date": "2026-05-10",
      "url": "https://example.com/demo/d4-cfo",
      "url_label": "示例公告",
      "evidence": "A",
      "questions": [
        "新任财务负责人是否有化工行业经验？",
        "结算政策与授信安排是否调整？"
      ],
      "action": "常规留痕，无需额外动作；续约时顺带确认结算联系人。",
      "tags": ["治理", "人事"]
    },
    {
      "id": "D1-E2",
      "date": "2026-03-01",
      "supplier_id": "D1",
      "supplier": "示例化工A",
      "category": "经营动态",
      "severity": "低",
      "direction": "中性",
      "title": "春季计划检修 15 天（窗口外背景）",
      "fact": "公司公告称，A 基地于 2026 年 3 月 1 日起进行年度计划检修，预计 15 天，期间一条生产线停车。",
      "why": "属于窗口外的背景事项，用于说明其检修节奏；不纳入近 6 个月计数。",
      "source": "示例化工A 检修公告（占位）",
      "source_type": "公司公告",
      "source_date": "2026-02-25",
      "url": "https://example.com/demo/d1-spring-maintenance",
      "url_label": "示例公告",
      "evidence": "A",
      "questions": [
        "今年是否还有第二次检修？",
        "检修是否影响既有合同的交付节奏？"
      ],
      "action": "作为背景留痕，不单独触发动作。",
      "tags": ["检修", "窗口外"]
    }
  ],
  "industry": [
    {
      "text": "示例行业当前处于产能扩张与需求平稳并存阶段；新增装置逐步投放，短期价格承压。以上为演示性描述，非真实行业判断。",
      "source": "示例行业资讯（占位）",
      "date": "2026-10-10"
    },
    {
      "text": "示例地区计划检修集中在三、四季度，检修损失量通常占月度产量的 3%–8%。以上为演示性描述。",
      "source": "示例协会月报（占位）",
      "date": "2026-09-30"
    }
  ],
  "coverage_check": [
    {"cat": "经营异常", "status": "未检索到公开记录", "note": "演示数据；真实项目需查国家企业信用信息公示系统与信用中国。", "level": "待复核"},
    {"cat": "行政处罚", "status": "1 条（海关，6 万元）", "note": "金额低，未见停产；需确认整改。", "level": "低"},
    {"cat": "诉讼仲裁", "status": "1 条（买卖合同纠纷，1,200 万元）", "note": "尚未判决；结合亏损关注现金流。", "level": "中"},
    {"cat": "安全环保事故", "status": "未检索到事故", "note": "仅见计划检修，不是事故；真实项目需查应急与生态环境公示。", "level": "待复核"},
    {"cat": "重大股权变化", "status": "未检索到", "note": "演示数据；真实项目需查交易所权益变动与工商变更。", "level": "—"},
    {"cat": "停产/项目变化", "status": "2 条（计划检修、试生产）", "note": "均为计划内安排，未见非计划停产。", "level": "中"}
  ],
  "method": {
    "scope": [
      "演示范围：4 家虚构供应商，6 条虚构事件，仅用于验证生成器。",
      "真实使用时：按产品与采购区域确定供应商全集，逐家检索工商、司法、处罚、安全环保、经营动态。",
      "时间口径：按事件发生日期归入 3/6/12 个月窗口，不以新闻发布时间代替。"
    ],
    "evidence_levels": [
      {"level": "A", "label": "可直接核对", "desc": "公司公告、交易所、政府/监管公示原文，或可核对的原始文件。"},
      {"level": "B", "label": "需回查", "desc": "主流财经媒体、行业媒体转述；需回到公告或监管原文核对。"},
      {"level": "C", "label": "仅作线索", "desc": "聚合平台、论坛、未具名信源；只能用于发现线索，不能单独下结论。"}
    ],
    "limits": [
      "演示数据全部为占位，不能用于任何真实决策。",
      "真实项目常见缺口：非上市企业财务不公开、地方处罚公示分散、司法文书公开滞后。",
      "公开信息存在滞后与遗漏；“未检索到”不等于“无风险”。"
    ],
    "search_queries": [
      "「产品名」+ 供应商 + 处罚 / 停产 / 事故 / 诉讼",
      "「公司名」+ 公告 / 环评 / 海关 / 应急管理局",
      "「产品名」+ 检修 / 新增产能 / 价格"
    ],
    "disclaimer": "本文件为演示用占位材料，企业、事件、金额、日期均为虚构，仅用于验证 data.json 结构与生成器；不构成任何法律、财务、投资或采购意见。"
  }
}
